{
  "event_id": "vehicle_signals-SIG-001-v42-update_postimage",
  "source": "azure-databricks",
  "catalog": "poc_notifications",
  "schema": "main",
  "table": "vehicle_signals",
  "primary_key": "SIG-001",
  "change_type": "update_postimage",
  "commit_version": 42,
  "commit_timestamp": "2026-08-05T08:10:00Z",
  "payload": {
    "signal_id": "SIG-001",
    "vehicle_id": "VEH-001",
    "signal_type": "speed",
    "signal_value": 60,
    "event_timestamp": "2026-08-05T08:09:58Z",
    "updated_at": "2026-08-05T08:10:00Z"
  }
}